{"agent":{"description":"Reconciles Paystack transactions against the orders sheet.","id":"payment-reconciler","name":"Payment Reconciler"},"approvals":{"require_for":["irreversible"],"timeout_seconds":120},"auth":{"delegated":[{"provider":"paystack","resources":["paystack.transactions"]},{"provider":"google_sheets","resources":["sheets.orders"]}],"hosted":{"kid":"2026-09","license_issuer":"reconciler-labs.example"},"mode":"hybrid"},"cleanup":{"hook":{"url":"https://reconciler-labs.example/alp/cleanup"},"publisher_retains":"aggregates"},"job":{"description":"Match settled Paystack transactions to open orders and mark matched orders as paid.","parameters":[{"name":"reference","type":"string"},{"name":"expected_amount_kobo","type":"integer"},{"name":"currency","type":"currency"}],"verifier":{"predicate":"count(rows where status = 'reconciled') >= 1","resource":"sheets.orders","type":"resource_query"}},"lease":{"max_duration_seconds":3600},"limits":{"actions_per_hour":300,"error_threshold":{"count":5,"window_seconds":300},"max_actions":500},"publisher":{"id":"reconciler-labs.example","name":"Reconciler Labs"},"scopes":[{"access":["read"],"resource":"paystack.transactions"},{"access":["read","write"],"resource":"sheets.orders"}],"spec_version":"alp/0.1","version":"0.1.0"}